title,link,Job Type,Qualification,Salary
Himachal Pradesh High Court Recruitment - Assistant Programmer Jobs,https://www.jobkaka.com/hp-high-court-recruitment-assistant-programmer-post/,Government,BE / BTech in Computer OR BSc/ BA/BCom and min 2 yrs experience OR 3 yrs Diploma in Computer and min 4 yrs experience,Rs.38500/-
Uttarakhand Public Service Commission Recruitment - Polytechnic Lecturer Jobs,https://www.jobkaka.com/ukpsc-recruitment-polytechnic-lecturer-post/,Government,B.Tech degree,No Details
Haryana Staff Selection Commission Recruitment - Commerce Group Various Post Jobs,https://www.jobkaka.com/hssc-recruitment-commerce-group-post/,Government,Passed HSSC Group C Exam,No Details
Sagarmala Development Company Recruitment - Assistant Manager  Jobs,https://www.jobkaka.com/sdcl-recruitment-assistant-manager-post/,Government,CA/ICWA/MBA (Fin.) and min 5 yrs experience,Rs.280000/-
Noida Metro Rail Corporation Recruitment - Senior Section Engineer and various other Jobs,https://www.jobkaka.com/nmrc-recruitment-nmrc-recruitment-2024-senior-section-engineer-post/,Government,Diploma,Rs.280000/-
Uttarakhand Public Service Commission Recruitment - Additional Private Secretary (APS) Jobs,https://www.jobkaka.com/ukpsc-recruitment-additional-private-secretary-post/,Government,graduate,No Details
Calcutta University Recruitment - Junior Research Fellow (Department of Biochemistry) Jobs,https://www.jobkaka.com/caluniv-recruitment-junior-research-fellow-post/,Government,graduate,Rs.31000/-
Himachal Pradesh Public Service Commission Recruitment - Assistant Professor and Unani Medical Officer Jobs,https://www.jobkaka.com/hppsc-recruitment-assistant-professor-post/,Government,Postgraduate degrees in the concerned speciality and min 3 yrs experience,Rs.37400-154300/-
National Institute of Technology Warangal Recruitment - Junior Research Fellow Jobs,https://www.jobkaka.com/nit-warangal-recruitment-junior-research-fellow-post/,Government,PhD / MTech or BTech with NET/GATE qualified,Rs.37000/-
Indian Army Recruitment - JAG Male Jobs,https://www.jobkaka.com/ia-recruitment-jag-male-post/,Government,graduate,No Details
UCO Bank Recruitment - Apprentice Jobs,https://www.jobkaka.com/uco-recruitment-apprentice-post/,Government,Bachelor Degree,No Details
Institute of Banking Personnel Selection Recruitment - Clerk Jobs,https://www.jobkaka.com/ibps-recruitment-clerk-post/,Government,Bachelor Degree in Any Stream,No Details
Joined Armed Forces Medical Services (AFMS) Recruitment - SSC Medical Officer (Male) and SSC Medical Officer (Female) Jobs,https://www.jobkaka.com/afms-recruitment-post/,Government,graduate,No Details
Jharkhand Staff Selection Commission Recruitment - Clerk Jobs,https://www.jobkaka.com/jssc-recruitment-clerk-post/,Government,Intermediate,No Details
Mizoram Public Service Commission Recruitment - Assistant Jailor Jobs,https://www.jobkaka.com/mizoram-psc-recruitment-assistant-jailor-post/,Government,Degree,No Details
Uttar Pradesh Subordinate Service Selection Commission Recruitment - BCG Technician Jobs,https://www.jobkaka.com/upsssc-recruitment-bcg-technician-post/,Government,12th Pass,No Details
Gujarat State Road Transport Corporation Recruitment - Conductor Jobs,https://www.jobkaka.com/gsrtc-recruitment-conductor-post/,Government,Intermediate (12th),Rs.18500/-
Tamil Nadu Motor Vehicle Maintenance Department Recruitment - Diploma (Technician) Apprentices and Graduate Apprentices Jobs,https://www.jobkaka.com/tnmvmd-recruitment-diploma-post/,Government,Diploma in Mechanical Engineering,Rs.9000/-
Tamil Nadu Generation and Distribution Corporation Recruitment - Technician Apprentices Jobs,https://www.jobkaka.com/tangedco-recruitment-technician-apprentices-post/,Government,Diploma in Engineering,Rs.8000/-
Gujarat State Police Housing Corporation Recruitment - Graduate Apprentice Jobs,https://www.jobkaka.com/gsphc-recruitment-graduate-apprentice-post/,Government,B.E /B.Tech,Rs.9000/-
Indian Bank Recruitment - Apprentice Jobs,https://www.jobkaka.com/ib-recruitment-apprentice-post/,Government,Bachelor Degree,No Details
Indo Tibetan Border Police Recruitment - Constable (Cobbler) and Constable (Tailor) Jobs,https://www.jobkaka.com/itbp-recruitment-constable-post/,Government,Graduate,No Details
Central Board of Indirect Taxes and Customs Recruitment - Tax Assistant Jobs,https://www.jobkaka.com/cbic-recruitment-tax-assistant-post/,Government,Bachelors Degree,No Details
Kudremukh Iron Ore Company Recruitment - Company Secretary Jobs,https://www.jobkaka.com/kiocl-recruitment-company-secretary-post/,Government,Degree,Rs.100000-260000/-
Odisha Coal and Power Limited Recruitment - Assistant Manager and various other Jobs,https://www.jobkaka.com/ocpl-recruitment-assistant-manager-post/,Government,BE/ BTech/ BSc/ MSc / Diploma,No Details
Hemchandracharya North Gujarat University Recruitment - Assistant Professor and various other Jobs,https://www.jobkaka.com/ngu-recruitment-assistant-professor-post/,Government,Master's degree,Rs.40000/-
REC Power Development and Consultancy Limited Recruitment - Officer (Engineering) and various other Jobs,https://www.jobkaka.com/recpdcl-recruitment-officer-post/,Government,B.E. /B.Tech or equivalent in Electrical/Electrical & Electronics/ Mechanical/ Civil or equivalent and min 2 yrs experience,Rs.200000/-
Steel Authority of India Limited Recruitment - Mechanical Engineering Jobs,https://www.jobkaka.com/sail-recruitment-mechanical-engineering-post/,Government,BE / B.Tech Engineering Degree,No Details
Hindustan Copper Limited Recruitment - Apprentices Jobs,https://www.jobkaka.com/hcl-recruitment-apprentices-post/,Government,ITI,No Details
National Aluminium Company Limited Recruitment - General Manager and various other Jobs,https://www.jobkaka.com/nalco-recruitment-general-manager-post/,Government,Degree,Rs.300000/-
Uttar Pradesh University of Medical Sciences Recruitment - Senior Administrative Assistant Jobs,https://www.jobkaka.com/upums-recruitment-senior-administrative-assistant-post/,Government,Graduate,No Details
Rajasthan Public Service Commission Recruitment - Deputy Jailor Jobs,https://www.jobkaka.com/rpsc-recruitment-deputy-jailor-post/,Government,Graduate,No Details
Punjab National Bank Recruitment - Apprentice Jobs,https://www.jobkaka.com/pnb-recruitment-apprentice-post/,Government,Bachelor Degree in Any Stream,No Details
Bihar State Power Holding Company Limited Recruitment - Junior Electrical Engineer -JEE (GTO) Jobs,https://www.jobkaka.com/bsphcl-recruitment-junior-electrical-engineer-post/,Government,Diploma (Engg),No Details
Chennai Metro Rail Limited Recruitment - Manager and various other Jobs,https://www.jobkaka.com/cmrl-recruitment-manager-post/,Government,Bachelors degree,Rs.2250000/-
BSE Odisha Recruitment - Odisha Teacher Eligibility Test Jobs,https://www.jobkaka.com/bse-recruitment-odisha-teacher-eligibility-test-post/,Government,"Higher Secondary, 2 year Diploma /BEd",No Details
HLL Lifecare Limited Recruitment - Pharmacist and Assistant Pharmacist Jobs,https://www.jobkaka.com/hll-recruitment-pharmacist-post/,Government,DPharm / BPharm,No Details
Chennai Metro Rail Limited Recruitment - Graduate Engineer Jobs,https://www.jobkaka.com/cmrl-recruitment-graduate-engineer-post/,Government,Graduate (Engg),No Details
Chhattisgarh State Power Transmission Company Limited Recruitment - Graduate Apprentice and Technician Apprentice Jobs,https://www.jobkaka.com/csptcl-recruitment-graduate-apprentice-post/,Government,BE / BTech,Rs.9000/-
Shaheed Hasan Khan Government Medical College Recruitment - Project Nurse – III and various other Jobs,https://www.jobkaka.com/gmc-mewat-recruitment-project-nurse-iii-post/,Government,Minimum Second Class or equivalent CGPA four year Nursing Course,Rs.67000/-
Guj Info Petro Limited Recruitment - Graduate Engineer Trainee (GET)/ Jr. Software Developer and various other Jobs,https://www.jobkaka.com/gipl-recruitment-graduate-engineer-trainee-post/,Government,B.E / B. Tech.,No Details
Uttar Pradesh Subordinate Service Selection Commission Recruitment - General Jobs,https://www.jobkaka.com/upsssc-recruitment-general-post/,Government,12th Pass,No Details
Haryana Public Service Commission Recruitment - Ayurvedic Medical Officer (AMO) Group D Jobs,https://www.jobkaka.com/hpsc-recruitment-ayurvedic-medical-officer-post/,Government,Degree in Ayurvedic System of Medicine,Rs.47600/-
Bihar Public Service Commission Recruitment - General Jobs,https://www.jobkaka.com/bpsc-recruitment-general-post/,Government,Graduate,No Details
National Institute for Empowerment of Persons with Multiple Disabilities Recruitment - Research Assistant Jobs,https://www.jobkaka.com/niepmd-recruitment-research-assistant-post/,Government,UG Degree with B.Ed SE/D.Ed SE OR PG Degree with M.Ed SE,Rs.24000-30000/-
Institute of Mathematical Sciences Recruitment - Scientific Officer C (Systems) Jobs,https://www.jobkaka.com/imsc-recruitment-scientific-officer-c-post/,Government,BSc OR BE/BTech,No Details
Central Institute of Mining and Fuel Research Recruitment - Project Associate I Jobs,https://www.jobkaka.com/cimfr-recruitment-project-associate-i-post/,Government,B.Tech. / M.Sc./M.Tech.,Rs.25000/-
Rashtriya Chemicals and Fertilizers Limited Recruitment - Junior Fireman Grade II Jobs,https://www.jobkaka.com/rcfl-recruitment-junior-fireman-grade-ii-post/,Government,SSC,Rs.42000/-
Kerala Development and Innovation Strategic Council Recruitment - Mother Animators- Mazhavillur Project Jobs,https://www.jobkaka.com/k-disc-recruitment-mother-animators-mazhavillur-project-post/,Government,Graduate,Rs.12500/-
Telecommunications Consultants India Limited Recruitment - SPOC /Project Manager Jobs,https://www.jobkaka.com/tcil-recruitment-spoc-project-manager-post/,Government,B.E. / B.TECH/M.TECH/MCA,Rs.80000/-
Cotton Corporation of India Limited Recruitment - Junior Commercial Executive and various other Jobs,https://www.jobkaka.com/cotcorp-recruitment-junior-commercial-executive-post/,Government,B.Sc Agriculture,Rs.140000/-
Bihar State Power Holding Company Limited Recruitment - Technician Gr III Jobs,https://www.jobkaka.com/bsphcl-recruitment-technician-gr-iii-post/,Government,Graduate,No Details
State Bank of India Recruitment - Trade Finance Officer (MMGS-II) and various other Jobs,https://www.jobkaka.com/sbi-recruitment-trade-finance-officer-post/,Government,Graduate in any discipline,Rs.78230/-
Uttar Pradesh Subordinate Service Selection Commission Recruitment - Junior Engineer JE Civil Jobs,https://www.jobkaka.com/upsssc-recruitment-unior-engineer-je-civil-post/,Government,Diploma in Civil Engineering,No Details
National Thermal Power Corporation Recruitment - Assistant Officer (Environment Management) Jobs,https://www.jobkaka.com/ntpc-recruitment-assistant-office1r-post/,Government,Graduate Engineering Degree,Rs.30000-120000/-
Indian Institute of Information Technology Design and Manufacturing Jabalpur Recruitment - Junior Research Fellow Jobs,https://www.jobkaka.com/iiitdm-jabalpur-recruitment-junior-research-fellow-post/,Government,B.E. / B.Tech or M.E./M.Tech,Rs.43660/-
Pimpri Chinchwad Municipal Corporation Recruitment - Medical Officer and various other Jobs,https://www.jobkaka.com/pcmc-recruitment-medical-officer-post/,Government,MBBS/BAMS,No Details
Rajasthan Public Service Commission Recruitment - Programmer Jobs,https://www.jobkaka.com/rpsc-recruitment-programmer1-post/,Government,B.E/ B.Tech/ M.sc in IT,No Details
Maharashtra National Law University Mumbai Recruitment - Visiting Faculty and various other Jobs,https://www.jobkaka.com/mnlu-mumbai-recruitment-visiting-faculty-post/,Government,Masters Degree,No Details
Prasar Bharati Recruitment - Finance Planner (Accounts) Jobs,https://www.jobkaka.com/pb-recruitment-finance-planner-post/,Government,CA/ CMA,Rs.75000-100000/-
National Institute of Oceanography Recruitment - Project Associate I and various other Jobs,https://www.jobkaka.com/nio-recruitment-project-associate-i-post/,Government,BE / BTech,Rs.56000/-
Bank of Baroda Recruitment - Senior Manager Business Finance and various other Jobs,https://www.jobkaka.com/bob-recruitment-senior-manager-business-finance-post/,Government,Graduation,No Details
NLC India Limited Recruitment - Trade Apprentices and various other Jobs,https://www.jobkaka.com/nlcil-recruitment-trade-apprentices-post/,Government,ITI,Rs.15028/-
Andaman Nicobar Islands Institute of Medical Sciences Recruitment - Nursing Officer Jobs,https://www.jobkaka.com/aniims-recruitment-nursing-officer-post/,Government,12th and Diploma in General Nursing/ Bsc. (Nursing),Rs.40000/-
AIIMS Nagpur Recruitment - Senior Resident and various other Jobs,https://www.jobkaka.com/aiims-recruitment-senior-resident-post/,Government,MD/ MS,Rs.177500/-
National Fertilizer Limited Recruitment - Management Trainee Jobs,https://www.jobkaka.com/nfl-recruitment-management-trainee-post/,Government,B.E./B.Tech/B.Sc Engineering/Master Degree,No Details
Power Grid Corporation of India Limited Recruitment - Engineer Trainee Electrical and various other Jobs,https://www.jobkaka.com/pgcil-recruitment-engineer-trainee-electrical-post/,Government,BE / B.Tech / B.SC Engineering Degree,No Details
North Eastern Hill University Recruitment - Project Associate Jobs,https://www.jobkaka.com/nehu-recruitment-project-associate-post/,Government,B.E. / B.Tech. in IT/CSE/ECE or MCA or M.Sc.in Computer Science/Electronics,Rs.25000-31000/-
National Fertilizer Limited Recruitment - Management Trainee Chemical Jobs,https://www.jobkaka.com/nfl-recruitment-management-trainee-chemical-post/,Government,BE / B.Tech / B.Sc. Engineering / Master Degree in Relevant Trade / Branch,No Details
Bank Note Paper Mill India Private Limited Recruitment - Process Assistant Grade -I (Mechanical) and various other Jobs,https://www.jobkaka.com/bnpm-recruitment-process-assistant-grade-i-post/,Government,10th/SSLC,Rs.24500/-
The Singareni Collieries Company Limited Recruitment - Management Trainee and various other Jobs,https://www.jobkaka.com/sccl-recruitment-management-trainee-post/,Government,Diploma,Rs.160000/-
"Sanjay Gandhi Post Graduate Institute, SGPGI Recruitment - Nursing Officer and various other Jobs",https://www.jobkaka.com/sgpgi-recruitment-technician-officer-post/,Government,B.Sc Nursing,No Details
Indian Air Force Recruitment - Airmen Group Y Recruitment 2024 Jobs,https://www.jobkaka.com/iaf-recruitment-airmen-group-y-post/,Government,10+2 Intermediate,No Details
Hindustan Petroleum Corporation Limited Recruitment - Manager and various other Jobs,https://www.jobkaka.com/hpcl-recruitment-manager-post/,Government,engineering course,Rs.3600000/-
Central Bank Of India Recruitment - Apprentice Jobs,https://www.jobkaka.com/cbi-recruitment-apprentice-post/,Government,Bachelor Degree in Any Stream,No Details
Rashtriya Chemicals and Fertilizers Limited Recruitment - Management Trainee (Chemical) and various other Jobs,https://www.jobkaka.com/rcfl-recruitment-management-trainee-fire-post/,Government,Graduate,Rs.30000/-
Rashtriya Chemicals and Fertilizers Limited Recruitment - Management Trainee (Chemical) Jobs,https://www.jobkaka.com/rcfl-recruitment-management-trainee-chemical-post/,Government,BE / B.Tech Degree in Chemical Engineering,No Details
Sanjay Gandhi Post Graduate Institute of Medical Sciences Recruitment - Nursing Officer and various other Jobs,https://www.jobkaka.com/sgpgims-recruitment-nursing-officer-post/,Government,B.Sc. (Hons) Nursing/B.Sc. Nursing,No Details
General Insurance Corporation of India Recruitment - Insurance and various other Jobs,https://www.jobkaka.com/gic-recruitment-insurance-post/,Government,Graduation,No Details
Nuclear Power Corporation of India Limited Recruitment - Assistant Grade I HR Jobs,https://www.jobkaka.com/npcil-recruitment-assistant-grade-i-hr-post/,Government,Bachelor Degree,No Details
Indira Gandhi Center for Atomic Research Recruitment - Scientific Officer / E (Medical) (General Surgery) Jobs,https://www.jobkaka.com/igcar-recruitment-scientific-officer1-post/,Government,M.B.B.S.,Rs.78800/-
Institute of Banking Personnel Selection Recruitment - Office Assistant Jobs,https://www.jobkaka.com/ibps-recruitment-office-assistant1-post/,Government,Graduation,No Details
All India Institute of Medical Sciences Bibinagar Recruitment - Project Technical Support III and various other Jobs,https://www.jobkaka.com/aiims-bibinagar-recruitment-project-technical-support-iii-post/,Government,Three Years Graduate,Rs.35560/-
Cochin Shipyard Limited Recruitment - Safety Assistant Jobs,https://www.jobkaka.com/csl-recruitment-safety-assistant-post/,Government,SSLC,Rs.24800/-
All India Institute of Medical Sciences Jodhpur Recruitment - Lab Technician Jobs,https://www.jobkaka.com/aiims-jodhpur-recruitment-lab-technician-post/,Government,B.Sc. MLT,Rs.18000/-
Central Building Research Institute Recruitment - Project Associate I Jobs,https://www.jobkaka.com/cbri-recruitment-project-associate-i-post/,Government,BArch/ BE/BTech or MSc,Rs.25000/-
Nulcear Power Corporation of India Limited Recruitment - Assistant Grade-I (HR) and various other Jobs,https://www.jobkaka.com/npcil-recruitment-assistant-grade-i-post/,Government,Bachelor Degree,Rs.38250/-
Railway Recruitment Board Recruitment - Technician Grade III and Technician Grade I Signal Jobs,https://www.jobkaka.com/rrb-recruitment-technician-gr-post/,Government,passed 10+2,No Details
Gujarat High Court Recruitment - Gujarati Steno. Grade-III Jobs,https://www.jobkaka.com/ghc-recruitment-gujarati-steno-grade-iii-post/,Government,Graduate in any discipline and Speed in Gujarati Short Hand 75 w.p.m.,Rs.142400/-
Deogiri College Maharashtra Recruitment - Assistant Professor Jobs,https://www.jobkaka.com/dcm-recruitment-assistant-professor-post/,Government,"Degree, PG Degree",No Details
Northeast Frontier Railway Recruitment - Level 1 and various other Jobs,https://www.jobkaka.com/nfr-recruitment-level-1-post/,Government,Passed Class 10th,No Details
Directorate General Border Security Force (Water Wing) Recruitment - Assistant Coomandant (Water Wing) Jobs,https://www.jobkaka.com/bsf-recruitment-assistant-coomandant-post/,Government,Bachelor Degree,Rs.56100/-
ITI Limited Recruitment - Company Secretary and Executive Jobs,https://www.jobkaka.com/itil-recruitment-company-secretary-post/,Government,Associate Membership (ACS),Rs.18700/-
Guru Gobind Singh Government Hospital Recruitment - Staff Nurse and various other Jobs,https://www.jobkaka.com/ggs-hospital-recruitment-staff-nurse-post/,Government,BSc Nursing / Diploma in GNM,Rs.63000/-
"All India Institute of Medical Science, Raipur Recruitment - Senior Resident (Non Academic) Jobs",https://www.jobkaka.com/aiims-raipur-recruitment-senior-resident-non-academic-post/,Government,PG Medical Degree,Rs.67700/-
Mizoram Public Service Commission Recruitment - Stenographer Grade III Jobs,https://www.jobkaka.com/mizoram-psc-recruitment-stenographer-grade-iii-post/,Government,Bachelor Degree,No Details
Patna High Court Recruitment - Translator Jobs,https://www.jobkaka.com/phc-recruitment-translator-post/,Government,Graduation,Rs.142400/-
Union Public Service Commission Recruitment - others and various other Jobs,https://www.jobkaka.com/upsc-recruitment-deputy-superintendingpost/,Government,degree,No Details
Society for Electronics Transactions and Security Recruitment - Project Associate and various other Jobs,https://www.jobkaka.com/sets-recruitment-project-associate-post/,Government,B.E / B.Tech,Rs.80000/-
The Hindustan Aeronautics Limited Recruitment - Operator (Fitter) and various other Jobs,https://www.jobkaka.com/hal-recruitment-operator-post/,Government,ITI Fitter With NAC/ NCTVT,Rs.23000/-
Bombay High Court Recruitment - Junior Translator and Interpreter Jobs,https://www.jobkaka.com/bhc-recruitment-junior-translator-post/,Government,Degree,No Details
The Institute of Company Secretaries of India Recruitment - IEPFA Executives Jobs,https://www.jobkaka.com/icsi-recruitment-iepfa-executives-post/,Government,Member of The Institute of Company Secretaries of India,Rs.60000/-
Meghalaya Police Recruitment - Constable and various other Jobs,https://www.jobkaka.com/mp-recruitment-constable-post/,Government,10+2 passed,Rs.22200-86400/-
Karnataka Public Service Commission Recruitment - Junior Engineer (Civil) and various other Jobs,https://www.jobkaka.com/kpsc-recruitment-junior-engineer-civilpost/,Government,Diploma in Civil Engineering,Rs.62600/-
Directorate General Border Security Force Recruitment - Jr Aircraft Maintenance Engineer and Assistant Commandant Jobs,https://www.jobkaka.com/bsf-recruitment-jr-aircraft-maintenance-engineer-post/,Government,Graduate with Aircraft Maintenance Engineer's License or equivalent,Rs.208700/-
Union Public Service Commission Recruitment - Army Jobs,https://www.jobkaka.com/upsc-recruitment-army-post/,Government,10+2 (Intermediate),No Details
Union Public Service Commission Recruitment - Officer Training Academy OTA and various other Jobs,https://www.jobkaka.com/upsc-recruitment-officer-training-academy-post/,Government,Bachelor Degree,No Details
Sanjay Gandhi Post Graduate Institute Recruitment - Nursing Officer and various other Jobs,https://www.jobkaka.com/sgpgi-recruitment-nursing-officer-post/,Government,B.Sc Nursing,No Details
High Court of Orissa Cuttack Recruitment - Assistant Section Officer Jobs,https://www.jobkaka.com/orissa-high-court-recruitment-assistant-section-officer1-post/,Government,Bachelor Degree,Rs.112400/-
Border Security Force Recruitment - Inspector Librarian and various other Jobs,https://www.jobkaka.com/bsf-recruitment-inspector-librarian-post/,Government,10+2,Rs.112400/-
Indian Air Force Recruitment - Medical Assistant Airmen Rally Jobs,https://www.jobkaka.com/indian-air-force-recruitment-medical-assistant-post/,Government,10+2 / Intermediate,No Details
High Court of Gujarat Recruitment - Court Attendant  Jobs,https://www.jobkaka.com/hcg-recruitment-post/,Government,10th passed,Rs.14800-126600/-
"Integrated Coach Factory, Chennai Recruitment - Apprentice (Fresher) Jobs",https://www.jobkaka.com/icf-recruitment-apprentice-fresher-post/,Government,"12th, Graduate",No Details
"South Eastern Railway, Railway Recruitment Cell Recruitment - Assistant Loco Pilot (ALP) and Trains Manager (Goods Guard) Jobs",https://www.jobkaka.com/rrc-ser-recruitment-assistant-loco-pilot-post/,Government,10th,No Details
National Institute of Cancer Prevention and Research Recruitment - Project Technical Officer Jobs,https://www.jobkaka.com/nicpr-recruitment-project-technical-officer-post/,Government,Graduation,No Details
"Integral Coach Factory, Chennai Recruitment - Freshers Jobs",https://www.jobkaka.com/icf-chennai-recruitment-freshers-post/,Government,"10th, 12th",No Details
"Employees State Insurance Corporation, Rajasthan Recruitment - Super Specialist and various other Jobs",https://www.jobkaka.com/esic-rajasthan-recruitment-super-specialist-post/,Government,Graduate,Rs.201213/-
"Indian Institute of Tropical Meterology, Pune Recruitment - Project Associate Jobs",https://www.jobkaka.com/iitm-pune-recruitment-project-associate-post/,Government,Degree,No Details
Bankura District Court Recruitment - Group D and various other Jobs,https://www.jobkaka.com/bdc-recruitment-group-d-post/,Government,Madhyamik,Rs.74500/-
Haryana Public Service Commission Recruitment - Assistant Director Jobs,https://www.jobkaka.com/hpsc-recruitment-assistant-director-post/,Government,Bachelor Degree,Rs.44900/-
Gajapati District Court Recruitment - Junior Clerk/Copyist and various other Jobs,https://www.jobkaka.com/gdc-recruitment-junior-clerk-copyist-post/,Government,"Degree, DCA",Rs.81100/-
J&K Bank Recruitment - Security Officer Jobs,https://www.jobkaka.com/jk-bank-recruitment-security-officer-post/,Government,Graduation,No Details
DRDO Centre for High Energy Systems and Sciences Recruitment - Technician (Diploma) Apprentice and Graduate (Degree) Apprentice Jobs,https://www.jobkaka.com/drdo-chess-recruitment-apprentice-post/,Government,Diploma in Engineering,Rs.9000/-
Arunachal Pradesh Staff Selection Board Recruitment - Multi Tasking Staff and various other Jobs,https://www.jobkaka.com/apssb-recruitment-multi-tasking-staff-post/,Government,10th and Ex-serviceman,Rs.92300/-
Karnataka Examination Authority or Bangalore Metropolitan Transport Corporation Recruitment - Manager Grade III Non Supervisory (RPC) Jobs,https://www.jobkaka.com/kea-recruitment-manager-grade-iii-post/,Government,PUC or 10+2 & Diploma,No Details
Rajasthan High Court Recruitment - Reference Assistant Jobs,https://www.jobkaka.com/rhc-recruitment-reference-assistant-post/,Government,Graduate,No Details
Jammu & Kashmir Bank Recruitment - Apprentice Jobs,https://www.jobkaka.com/jk-bank-recruitment-apprentice-post/,Government,Graduation,Rs.10500/-
Chhattisgarh Professional Examination Board Recruitment - Chhattisgarh State Eligibility Test (CG SET 2024) Jobs,https://www.jobkaka.com/cgvyapam-recruitment-cg-set-2024-post/,Government,Postgraduate degree,No Details
Himachal Pradesh Board of School Education Recruitment - TGT and various other Jobs,https://www.jobkaka.com/school-education-board-hp-recruitment-tgt-post/,Government,Graduate,No Details
Maharashtra Public Service Commission Recruitment - State Services  Jobs,https://www.jobkaka.com/mpsc-recruitment-state-services-post/,Government,Degree,No Details
Indore District Recruitment - Junior Assistant Jobs,https://www.jobkaka.com/indore-recruitment-junior-assistant-post/,Government,Bachelors degree,Rs.25500/-
RRB Railway Protection Force Recruitment - Sub Inspector (SI) Jobs,https://www.jobkaka.com/rrb-rpf-recruitment-sub-inspector-post/,Government,Graduation,Rs.35400/-
Indian Council of Agricultural Research Complex for NEH Region Recruitment - Young Professional I and various other Jobs,https://www.jobkaka.com/icar-neh-region-recruitment-young-professional-i-post/,Government,B.Tech,Rs.54000/-
