title,link,Job Type,Qualification,Salary
Institute of Banking Personnel Selection Recruitment 2025 - Customer Service Associates and other Posts Jobs,https://www.jobkaka.com/ibps-customer-service-associates-post/,Government,Not Applicable,No Details
Hindustan Aeronautics Limited Recruitment 2025 - Graduate Apprentice Jobs,https://www.jobkaka.com/hal-graduate-apprentice-post/,Government,Graduate,No Details
Bank of Baroda Recruitment 2025 - VP: Head Cloud CoE Jobs,https://www.jobkaka.com/bob-vp-head-cloud-coe-post/,Government,Graduate,No Details
Bank of Baroda Recruitment 2025 - Manager - Digital Product Jobs,https://www.jobkaka.com/bob-manager-digital-product-post/,Government,Graduate,Rs.48480-85920/-
ICMR - National Institute of Traditional Medicine (NITM) Recruitment 2025 - Young Professional-I (Information Technology) Jobs,https://www.jobkaka.com/icmr-nitm-young-professionali-information-technology-post/,Government,Graduate,Rs.30000-30000/-
Union Public Service Commission (UPSC) Recruitment 2025 - Assistant Director (Systems) Jobs,https://www.jobkaka.com/upsc-assistant-director-systems-post/,Government,Graduate,Rs.56100-177500/-
Bank of Baroda Recruitment 2025 - Assistant Vice President I - Data Analyst/Data Scientist Jobs,https://www.jobkaka.com/bob-assistant-vice-president-i-data-analystdata-scientist-post/,Government,Graduate,No Details
Railway Recruitment Board (RRB) Recruitment 2025 - Nursing Superintendent Jobs,https://www.jobkaka.com/rrb-nursing-superintendent-post/,Government,Graduate,No Details
"Controller General of Patents, Designs & Trade Marks Recruitment 2025 - Patent Agent Jobs",https://www.jobkaka.com/cgpdtm-patent-agent-post/,Government,Graduate,No Details
Gujarat Urban Development Mission Recruitment 2025 - Senior Urban Planner Jobs,https://www.jobkaka.com/gudm-senior-urban-planner-post/,Government,Postgraduate,No Details
राजस्थान लोक सेवा आयोग (RPSC) Recruitment 2025 - पशु चिकित्सा अधिकारी Jobs,https://www.jobkaka.com/rpsc-post-3/,Government,Graduate,No Details
राजस्थान कर्मचारी चयन बोर्ड (RSSB) Recruitment 2025 - आयुष अधिकारी Jobs,https://www.jobkaka.com/rssb-post-3/,Government,Graduate,No Details
Institute of Banking Personnel Selection Recruitment 2025 - Probationary Officer PO / Management Trainee MT-XIV Jobs,https://www.jobkaka.com/ibps-probationary-officer-po-management-trainee-mtxiv-post/,Government,Graduate,No Details
Pawan Hans Limited Recruitment 2025 - Graduate Engineer Trainee (Civil) Jobs,https://www.jobkaka.com/pawan-hans-graduate-engineer-trainee-civil-post/,Government,Graduate,Rs.50000-50000/-
राजस्थान लोक सेवा आयोग Recruitment 2025 - स्कूल लेक्चरर Jobs,https://www.jobkaka.com/rpsc-post/,Government,Graduate,No Details
Indian Council of Social Science Research Recruitment 2025 - Senior Internship Jobs,https://www.jobkaka.com/icssr-senior-internship-post/,Government,Master's,Rs.25000-25000/-
"Visva-Bharati University Recruitment 2025 - Director of Physical Education, Sports, National Service, and Student Welfare and other Posts Jobs",https://www.jobkaka.com/visva-bharati-director-of-physical-education-sports-national-service-and-student-welfare-post/,Government,Master's,Rs.35400-218200/-
Bangalore Metro Rail Corporation Limited (BMRCL) Recruitment 2025 - Chief Engineer (Utility Shifting) Jobs,https://www.jobkaka.com/bmrcl-chief-engineer-utility-shifting-post/,Government,Graduate,Rs.206250-210693/-
"Armoured Vehicles Nigam Limited (AVNL), Heavy Vehicles Factory (HVF) Recruitment 2025 - Assistant Manager/Tech Jobs",https://www.jobkaka.com/avnl-assistant-managertech-post/,Government,Graduate,Rs.30000-40000/-
Rajasthan Public Service Commission (RPSC) Recruitment 2025 - Veterinary Officer Jobs,https://www.jobkaka.com/rpsc-veterinary-officer-post/,Government,Graduate,No Details
Rajasthan Staff Selection Board Recruitment 2025 - Primary School Teacher Jobs,https://www.jobkaka.com/rssb-primary-school-teacher-post/,Government,Graduate,No Details
Dayalbagh Educational Institute Recruitment 2025 - Centres in Charge and other Posts Jobs,https://www.jobkaka.com/dei-centres-in-charge-post/,Government,Graduate,No Details
"Hindustan Aeronautics Limited (HAL), Aircraft Division, Nashik Recruitment 2025 - Engineering Graduate Apprentice Jobs",https://www.jobkaka.com/hal-engineering-graduate-apprentice-post-2/,Government,Graduate,Rs.8000-9000/-
Ratnagiri Gas and Power Private Limited Recruitment 2025 - Executives Expertise Jobs,https://www.jobkaka.com/rgppl-executives-expertise-post/,Government,Graduate,No Details
"Indian Ports Association Recruitment 2025 - Accounts Officer, Grade - I Jobs",https://www.jobkaka.com/ipa-accounts-officer-grade-i-post/,Government,Professional,Rs.50000-160000/-
Uttar Pradesh Public Service Commission (UPPSC) Recruitment 2025 - Assistant Teacher TGT Male Jobs,https://www.jobkaka.com/uppsc-assistant-teacher-tgt-male-post/,Government,Graduate,No Details
National Mineral Development Corporation Recruitment 2025 - Junior Manager Jobs,https://www.jobkaka.com/nmdc-junior-manager-post/,Government,Graduate,Rs.37000-130000/-
Advanced Weapons and Equipment India Limited (AWEIL) Recruitment 2025 - Executive Finance Jobs,https://www.jobkaka.com/aweil-executive-finance-post/,Government,Postgraduate,Rs.90000-90000/-
Union Public Service Commission (UPSC) Recruitment 2025 - Assistant Drugs Controller (India) (Medical Devices) and other Posts Jobs,https://www.jobkaka.com/upsc-assistant-drugs-controller-india-medical-devices-post/,Government,Graduate,Rs.44900-208700/-
"Gargi College, University of Delhi Recruitment 2025 - Assistant Professor Jobs",https://www.jobkaka.com/gargi-college-assistant-professor-post/,Government,Master's,Rs.57700-182400/-
Indian Bank Rural Self Employment Training Institute (INDSETI) Recruitment 2025 - Office Assistant Jobs,https://www.jobkaka.com/indian-bank-office-assistant-post/,Government,Graduate,Rs.20000-27500/-
NHPC Limited Recruitment 2025 - Graduate Apprentice Jobs,https://www.jobkaka.com/nhpc-graduate-apprentice-post/,Government,Graduate,Rs.12000-12000/-
"Goa State Rural Livelihood Mission Recruitment 2025 - State Program Manager (Mobilization, Counseling, Job Fairs & Selection, Alumni, Migration Support, Placement, Retention, Tracking & Career Progression Tracking) and other Posts Jobs",https://www.jobkaka.com/gsrlm-state-program-manager-mobilization-counseling-job-fairs-selection-alumni-migration-support-placement-retention-tracking-career-progression-tracking-post/,Government,Master's,Rs.40000-50000/-
Maharashtra State Electricity Distribution Company Limited Recruitment 2025 - Sr Manager (F&A) Jobs,https://www.jobkaka.com/mahadiscom-sr-manager-fa-post/,Government,Graduate,Rs.97220-209445/-
National Industrial Corridor Development Corporation (NICDC) Limited Recruitment 2025 - Deputy General Manager (Projects) Jobs,https://www.jobkaka.com/nicdc-deputy-general-manager-projects-post/,Government,Graduate,Rs.3000000/-
Join Indian Coast Guard Recruitment 2025 - Assistant Commandant (CGCAT 2027 Batch) and other Posts Jobs,https://www.jobkaka.com/icg-assistant-commandant-cgcat-2027-batch-post/,Government,Graduate,No Details
National Housing Bank (NHB) Recruitment 2025 - Chief Technology Officer Jobs,https://www.jobkaka.com/nhb-chief-technology-officer-post/,Government,Master's,Rs.85000-500000/-
Bank of Baroda Recruitment 2025 - Assistant Vice President I - Agile Transformation Expert Jobs,https://www.jobkaka.com/bob-assistant-vice-president-i-agile-transformation-expert-post/,Government,Graduate,No Details
Haryana Rail Infrastructure Development Corporation Ltd. (HRIDC) Recruitment 2025 - Executive/OHE Jobs,https://www.jobkaka.com/hridc-executiveohe-post/,Government,Graduate,Rs.38000-38000/-
Delhi High Court Recruitment 2025 - Law Researcher Jobs,https://www.jobkaka.com/dhc-law-researcher-post/,Government,Graduate,Rs.65000-65000/-
National Health Mission Uttar Pradesh Recruitment 2025 - Medical Officer Jobs,https://www.jobkaka.com/nhm-up-medical-officer-post/,Government,Graduate,Rs.80000-100000/-
Tamilnad Mercantile Bank Recruitment 2025 - Global NRI Center Head (GNC) Jobs,https://www.jobkaka.com/tmb-global-nri-center-head-gnc-post/,Government,Graduate,No Details
"Institute of Infrastructure, Technology, Research and Management Recruitment 2025 - Registrar Jobs",https://www.jobkaka.com/iitram-registrar-post/,Government,Master's,Rs.56100-144200/-
Institute of Banking Personnel Selection Recruitment 2025 - Division Head (Financial & Allied Services) & CFO Jobs,https://www.jobkaka.com/ibps-division-head-financial-allied-services-cfo-post/,Government,Master's,Rs.2815000/-
Kerala Cooperative Milk Marketing Federation Limited Recruitment 2025 - Sales Officer Jobs,https://www.jobkaka.com/kcmmf-sales-officer-post/,Government,Master's,Rs.47000/-
Punjab Subordinate Service Selection Board Recruitment 2025 - Naib Tehsildar Jobs,https://www.jobkaka.com/psssb-naib-tehsildar-post/,Government,Graduate,Rs.35400-35400/-
National Institute of Technology Jamshedpur Recruitment 2025 - Principal Scientific Officer Jobs,https://www.jobkaka.com/nit-jamshedpur-principal-scientific-officer-post/,Government,Postgraduate,Rs.144200/-
State Bank of India Recruitment 2025 - SBI Circle Based Officer CBO Jobs,https://www.jobkaka.com/sbi-sbi-circle-based-officer-cbo-post-2/,Government,Graduate,No Details
National Institute of Technology Arunachal Pradesh Recruitment 2025 - Registrar Jobs,https://www.jobkaka.com/nit-arunachal-pradesh-registrar-post/,Government,Master's,Rs.56100-218200/-
"Gujarat Council of Science City Recruitment 2025 - Technician, Executive Assistant and Various Jobs",https://www.jobkaka.com/gcsc-technician-executive-assistant-and-various-post/,Government,Graduate,No Details
Pilibhit District Recruitment 2025 - Medical Officer Jobs,https://www.jobkaka.com/pilibhit-medical-officer-post/,Government,Graduate,Rs.100000-100000/-
Chaudhary Charan Singh University Recruitment 2025 - Junior Research Assistant Jobs,https://www.jobkaka.com/ccs-university-junior-research-assistant-post/,Government,Master's,Rs.25000-25000/-
Madhya Pradesh Public Service Commission Recruitment 2025 - Food Safety Officer (FSO) Jobs,https://www.jobkaka.com/mppsc-food-safety-officer-fso-post/,Government,Doctoral,Rs.36200-114800/-
Pension Fund Regulatory and Development Authority Recruitment 2025 - Assistant Manager (Officer Grade A) - General Jobs,https://www.jobkaka.com/pfrda-assistant-manager-officer-grade-a-general-post/,Government,Graduate,No Details
General Insurance Corporation of India (GIC) Recruitment 2025 - Company Secretary (General Manager) Jobs,https://www.jobkaka.com/gic-company-secretary-general-manager-post/,Government,Graduate,No Details
HLL Lifecare Limited Recruitment 2025 - Graduate Trainee Jobs,https://www.jobkaka.com/hll-graduate-trainee-post/,Government,Graduate,Rs.10000-12500/-
"All India Institute of Medical Sciences, New Delhi Recruitment 2025 - Field Worker Jobs",https://www.jobkaka.com/aiims-delhi-field-worker-post/,Government,Graduate,Rs.18000-18000/-
National Highways InvIT Project Managers Private Limited Recruitment 2025 - Assistant Highway Engineer (AHE) Jobs,https://www.jobkaka.com/nhipmpl-assistant-highway-engineer-ahe-post/,Government,Graduate,Rs.45000-45000/-
Engineers India Limited Recruitment 2025 - Associate Engineer Grade II (Process) Jobs,https://www.jobkaka.com/eil-associate-engineer-grade-ii-process-post/,Government,Graduate,Rs.72000-80000/-
Indian Institute of Management Mumbai Recruitment 2025 - Junior Program Manager Jobs,https://www.jobkaka.com/iim-mumbai-junior-program-manager-post/,Government,Graduate,Rs.19900-142400/-
Gujarat University Recruitment 2025 - Assistant Professor / Teaching Assistant (University School of Law) Jobs,https://www.jobkaka.com/gu-assistant-professor-teaching-assistant-university-school-of-law-post/,Government,Doctorate,Rs.20000-54000/-
National Institute of Electronics and Information Technology Recruitment 2025 - Project Associate (AEL) Jobs,https://www.jobkaka.com/nielit-project-associate-ael-post/,Government,Graduate,No Details
All India Institute of Medical Sciences (AIIMS) Bilaspur Recruitment 2025 - Junior Resident (Non-Academic) Jobs,https://www.jobkaka.com/aiims-bilaspur-junior-resident-nonacademic-post/,Government,Graduate,Rs.56100-56100/-
West Bengal Central School Service Commission Recruitment 2025 - Assistant Teacher (Classes IX-X) Jobs,https://www.jobkaka.com/wbssc-assistant-teacher-classes-ixx-post/,Government,Master's,No Details
Atomic Energy Education Society Recruitment 2025 - TGT Jobs,https://www.jobkaka.com/aees-tgt-post/,Government,Graduate,Rs.34125-34125/-
Oil and Natural Gas Corporation Limited Recruitment 2025 - Contract Medical Officer - Field Duty (FMO) Jobs,https://www.jobkaka.com/ongc-contract-medical-officer-field-duty-fmo-post/,Government,Graduate,Rs.105000/-
National Insurance Company Limited Recruitment 2025 - Administrative Officer (Generalist & Specialist) Scale I Jobs,https://www.jobkaka.com/nicl-administrative-officer-generalist-specialist-scale-i-post/,Government,Graduate,Rs.90000-90000/-
Supreme Court of India Recruitment 2025 - Junior Court Assistant/Junior Programmer and other Posts Jobs,https://www.jobkaka.com/sci-junior-court-assistantjunior-programmer-post/,Government,Graduate,Rs.35400-47600/-
Federal Bank Recruitment 2025 - Associate Officer (Sales) Jobs,https://www.jobkaka.com/federal-bank-associate-officer-sales-post/,Government,Graduate,No Details
Maharashtra Public Service Commission Recruitment 2025 - Assistant Section Officer Jobs,https://www.jobkaka.com/mpsc-assistant-section-officer-post/,Government,Graduate,Rs.44900-142400/-
Sardar Vallabhbhai Patel International School of Textiles & Management Recruitment 2025 - Assistant Professor - Management Jobs,https://www.jobkaka.com/svpistm-assistant-professor-management-post/,Government,Master's,No Details
MECON Limited Recruitment 2025 - Senior Engineer (Civil) Jobs,https://www.jobkaka.com/mecon-senior-engineer-civil-post/,Government,Graduate,No Details
Central Bank of India Recruitment 2025 - Apprentice Jobs,https://www.jobkaka.com/cbi-apprentice-post/,Government,Graduate,Rs.15000-15000/-
NTPC Limited Recruitment 2025 - Assistant Engineer (Operation) Jobs,https://www.jobkaka.com/ntpc-assistant-engineer-operation-post/,Government,Graduate,No Details
Hindustan Shipyard Limited Recruitment 2025 - Additional General Manager (Legal) Jobs,https://www.jobkaka.com/hsl-additional-general-manager-legal-post/,Government,Graduate,Rs.90000-240000/-
National Atmospheric Research Laboratory (NARL) Recruitment 2025 - Junior Research Fellow Jobs,https://www.jobkaka.com/narl-junior-research-fellow-post/,Government,Master's,Rs.37000-37000/-
"Directorate of Aviation, Odisha Recruitment 2025 - Director of Aviation Jobs",https://www.jobkaka.com/odisha-aviation-director-of-aviation-post/,Government,Master's,Rs.250000-250000/-
Deendayal Port Authority Recruitment 2025 - Management Trainee Jobs,https://www.jobkaka.com/dpa-management-trainee-post/,Government,Postgraduate,Rs.25000-25000/-
Export-Import Bank of India Recruitment 2025 - Compliance Officer (CGM) Jobs,https://www.jobkaka.com/exim-bank-compliance-officer-cgm-post/,Government,Graduate,Rs.156500-173860/-
Mineral Exploration and Consultancy Limited Recruitment 2025 - Executive Trainee (Geology) Jobs,https://www.jobkaka.com/mecl-executive-trainee-geology-post/,Government,Master's,Rs.40000-140000/-
Uttar Pradesh Public Service Commission Recruitment 2025 - Farm Manager/Assistant Director (Farms)/Fodder Development Officer/Agriculture Officer Jobs,https://www.jobkaka.com/uppsc-farm-managerassistant-director-farmsfodder-development-officeragriculture-officer-post/,Government,Postgraduate,Rs.15600/-
Sardar Swaran Singh National Institute of Bio-Energy Recruitment 2025 - Junior Research Fellow Jobs,https://www.jobkaka.com/nibe-junior-research-fellow-post/,Government,Graduate,Rs.37000-37000/-
Central Public Works Department Recruitment 2025 - Accounts & Supervisor Jobs,https://www.jobkaka.com/cpwd-accounts-supervisor-post-2/,Government,Graduate,Rs.47600-151100/-
Bihar Public Service Commission (BPSC) Recruitment 2025 - Bihar BPSC Various Post Under 71st Pre 2025 Jobs,https://www.jobkaka.com/bpsc-bihar-bpsc-various-post-under-71st-pre-2025-post/,Government,Graduate,No Details
Indira Gandhi Institute of Development Research Recruitment 2025 - Junior Library Assistant Jobs,https://www.jobkaka.com/igidr-junior-library-assistant-post/,Government,Graduate,Rs.12000-12000/-
Kannur University Recruitment 2025 - Guest Faculty Jobs,https://www.jobkaka.com/kannur-university-guest-faculty-post/,Government,Postgraduate,Rs.1600-1750/-
Ministry of Steel Recruitment 2025 - Young Professionals Jobs,https://www.jobkaka.com/ministry-of-steel-young-professionals-post/,Government,Graduate,Rs.80000-100000/-
Brahmaputra Valley Fertilizer Corporation Limited Recruitment 2025 - General Manager (Production) (E-8) Jobs,https://www.jobkaka.com/bvfcl-general-manager-production-e8-post/,Government,Graduate,Rs.51300-73000/-
National Highways Authority of India Recruitment 2025 - Deputy Manager (Technical) Jobs,https://www.jobkaka.com/nhai-deputy-manager-technical-post/,Government,Graduate,Rs.56100-177500/-
Balmer Lawrie Recruitment 2025 - Manager [Manufacturing] and other Posts Jobs,https://www.jobkaka.com/balmer-lawrie-manager-manufacturing-post/,Government,Graduate,Rs.40000-200000/-
Purba Bardhaman District Recruitment 2025 - Municipality Level Assistant Accountant Jobs,https://www.jobkaka.com/purba-bardhaman-municipality-level-assistant-accountant-post/,Government,Graduate,Rs.11000-11000/-
Central Electronics Engineering Research Institute Recruitment 2025 - Project Associate Jobs,https://www.jobkaka.com/ceeri-project-associate-post/,Government,Graduate,Rs.25000-31000/-
Mazagon Dock Shipbuilders Limited Recruitment 2025 - Chief Manager Jobs,https://www.jobkaka.com/mdl-chief-manager-post/,Government,Master's,Rs.80000-220000/-
Khandwa District Recruitment 2025 - Office Assistant Jobs,https://www.jobkaka.com/khandwa-office-assistant-post/,Government,Graduate,Rs.18000-18000/-
Nuclear Power Corporation of India Limited Recruitment 2025 - Stipendiary Trainee/Scientific Assistant (Category-I) Jobs,https://www.jobkaka.com/npcil-stipendiary-traineescientific-assistant-categoryi-post/,Government,Graduate,No Details
Traditional Knowledge Digital Library Recruitment 2025 - Project Associate I Jobs,https://www.jobkaka.com/tkdl-project-associate-i-post/,Government,Master's,Rs.25000-31000/-
Electronics Corporation of India Recruitment 2025 - Graduate Engineer Trainee Jobs,https://www.jobkaka.com/ecil-graduate-engineer-trainee-post/,Government,Graduate,No Details
Rajmata Vijayaraje Scindia Krishi Vishwa Vidyalaya Recruitment 2025 - Young Professional I Jobs,https://www.jobkaka.com/rvskvv-young-professional-i-post-2/,Government,Graduate,Rs.30000-30000/-
Central University of Rajasthan (CURAJ) Recruitment 2025 - Executive Engineer (Civil) Jobs,https://www.jobkaka.com/curaj-executive-engineer-civil-post/,Government,Graduate,Rs.10000/-
DRDO Young Scientist Laboratory - Artificial Intelligence Recruitment 2025 - Junior Research Fellow (JRF) Jobs,https://www.jobkaka.com/drdo-dysl-ai-junior-research-fellow-jrf-post/,Government,Master's,Rs.37000-48100/-
"Advanced Centre for Energetic Materials (ACEM), DRDO Recruitment 2025 - Graduate Apprentice Jobs",https://www.jobkaka.com/drdo-graduate-apprentice-post/,Government,Graduate,Rs.10000-12000/-
Guru Gobind Singh Indraprastha University Recruitment 2025 - Creative Graphic Designer Jobs,https://www.jobkaka.com/ggsipu-creative-graphic-designer-post/,Government,Master's,No Details
Mahesh Sahakari Bank Pune Recruitment 2025 - Clerk Jobs,https://www.jobkaka.com/mahesh-bank-clerk-post/,Government,Graduate,No Details
IRCON International Limited Recruitment 2025 - Executive/ Civil (E-0) Jobs,https://www.jobkaka.com/ircon-executive-civil-e0-post/,Government,Graduate,Rs.30000-120000/-
Sant Shiromani Ravidas Global Skills Park Recruitment 2025 - Executives Jobs,https://www.jobkaka.com/global-skills-park-executives-post/,Government,Graduate,No Details
IRCON International Limited Recruitment 2025 - Assistant Manager/Electrical (E-1) Jobs,https://www.jobkaka.com/ircon-assistant-managerelectrical-e1-post/,Government,Graduate,Rs.40000-140000/-
Arunachal Pradesh Public Service Commission Recruitment 2025 - Assistant Engineer Jobs,https://www.jobkaka.com/appsc-assistant-engineer-post/,Government,Graduate,Rs.56100-177500/-
National Council of Educational Research and Training Recruitment 2025 - Computer Programmer and other Posts Jobs,https://www.jobkaka.com/ncert-computer-programmer-post/,Government,Graduate,Rs.35000-50000/-
Himachal Pradesh State Cooperative Bank Ltd. Recruitment 2025 - System Analyst Jobs,https://www.jobkaka.com/hpscb-system-analyst-post/,Government,Graduate,Rs.29200-35400/-
Central Bank of India Recruitment 2025 - Incharge / Counselor for FLCs Jobs,https://www.jobkaka.com/cbi-incharge-counselor-for-flcs-post/,Government,Graduate,Rs.26000/-
Hindustan Petroleum Corporation Limited Recruitment 2025 - Graduate Apprentice Trainees Jobs,https://www.jobkaka.com/hpcl-graduate-apprentice-trainees-post/,Government,Graduate,Rs.20500-25000/-
Bihar Rural Livelihoods Promotion Society Recruitment 2025 - Consultant - E-Commerce (District Level) Jobs,https://www.jobkaka.com/brlps-consultant-ecommerce-district-level-post/,Government,Graduate,Rs.55000-80000/-
Indian Institute of Management Kashipur Recruitment 2025 - Field Investigators and other Posts Jobs,https://www.jobkaka.com/iim-kashipur-field-investigators-post/,Government,Graduate,Rs.30000-35000/-
Department of Health and Family Welfare Meghalaya Recruitment 2025 - Medical Health Officer Jobs,https://www.jobkaka.com/dhfw-meghalaya-medical-health-officer-post/,Government,Graduate,Rs.60000-60000/-
West Khasi Hills District Recruitment 2025 - Office Assistant / Clerk (DLSA) Jobs,https://www.jobkaka.com/wkhd-office-assistant-clerk-dlsa-post/,Government,Graduate,Rs.15000-15000/-
Delhi Development Authority Recruitment 2025 - Consultant (Landscape Architect) Jobs,https://www.jobkaka.com/dda-consultant-landscape-architect-post/,Government,Master's,No Details
New Mangalore Port Trust Recruitment 2025 - Graduate Apprentice Trainee Jobs,https://www.jobkaka.com/nmpt-graduate-apprentice-trainee-post/,Government,Graduate,Rs.9000-9000/-
National Centre for Disease Informatics and Research Recruitment 2025 - Young Professional-I (YP-I) (IT)-(Graphics Design/Video Production) and other Posts Jobs,https://www.jobkaka.com/ncdir-young-professionali-ypi-itgraphics-designvideo-production-post/,Government,Graduate,Rs.30000-42000/-
Rajmata Vijayaraje Scindia Krishi Vishwa Vidyalaya Recruitment 2025 - Young Professional I Jobs,https://www.jobkaka.com/rvskvv-young-professional-i-post/,Government,Graduate,Rs.30000-30000/-
Mineral Exploration & Consultancy Limited Recruitment 2025 - Young Professional (Geology) Jobs,https://www.jobkaka.com/mecl-young-professional-geology-post/,Government,Master's,Rs.60000-60000/-
Jammu and Kashmir Public Service Commission Recruitment 2025 - Civil Judge Jobs,https://www.jobkaka.com/jkpsc-civil-judge-post/,Government,Graduate,Rs.77840-136520/-
"Uttar Pradesh Public Service Commission Recruitment 2025 - Farm Manager, Assistant Director (Farms), Fodder Development Officer, and Agriculture Officer Jobs",https://www.jobkaka.com/uppsc-farm-manager-assistant-director-farms-fodder-development-officer-and-agriculture-officer-post/,Government,Graduate,No Details
Andaman and Nicobar Administration Recruitment 2025 - Gender Specialist Jobs,https://www.jobkaka.com/ana-gender-specialist-post/,Government,Master's,Rs.20000-25000/-
Tezpur University Recruitment 2025 - Internal Audit Officer Jobs,https://www.jobkaka.com/tezpur-university-internal-audit-officer-post/,Government,Master's,Rs.18000-209200/-
National Bank for Financing Infrastructure and Development Recruitment 2025 - Senior Analyst (Full Time Regular Basis) and other Posts Jobs,https://www.jobkaka.com/nabfid-senior-analyst-full-time-regular-basis-post/,Government,Master's,No Details
"Swami Shraddhanand College, University of Delhi Recruitment 2025 - Administrative Officer Jobs",https://www.jobkaka.com/ssc-administrative-officer-post/,Government,Master's,No Details
IHB Limited Recruitment 2025 - Deputy Manager (HSE) Jobs,https://www.jobkaka.com/ihb-deputy-manager-hse-post/,Government,Graduate,Rs.700000-1100000/-
Uttarakhand Subordinate Service Selection Commission Recruitment 2025 - Assistant Review Officer Jobs,https://www.jobkaka.com/uksssc-assistant-review-officer-post/,Government,Graduate,Rs.44900-142400/-
Aavantika Gas Limited Recruitment 2025 - Deputy Manager (Finance & Accounts) Jobs,https://www.jobkaka.com/agl-deputy-manager-finance-accounts-post/,Government,Graduate,Rs.1080000/-
National Institute of Design Recruitment 2025 - Senior Faculty Jobs,https://www.jobkaka.com/nid-senior-faculty-post/,Government,Doctorate,Rs.78800-209200/-
"National Remote Sensing Centre, ISRO Recruitment 2025 - Scientist / Engineer ‘SC’ (Forestry & Ecology) Jobs",https://www.jobkaka.com/nrsc-scientist-engineer-sc-forestry-ecology-post/,Government,Master's,Rs.56100-177500/-
Madhya Pradesh Industrial Development Corporation Limited Recruitment 2025 - Assistant Engineer Jobs,https://www.jobkaka.com/mpidc-assistant-engineer-post/,Government,Graduate,Rs.56100-177500/-
Uttar Pradesh Public Service Commission Recruitment 2025 - Assistant Director Jobs,https://www.jobkaka.com/uppsc-assistant-director-post/,Government,Graduate,No Details
Central Public Works Department Recruitment 2025 - Accounts & Supervisor Jobs,https://www.jobkaka.com/cpwd-accounts-supervisor-post/,Government,Graduate,Rs.47600-151100/-
