title,link,Job Type,Qualification,Salary
South Indian Bank Recruitment 2026 - Junior Officer Jobs,https://www.jobkaka.com/sib-junior-officer-post/,Government,Graduate,Rs.756000/-
CSIR-National Aerospace Laboratories Recruitment 2026 - Project Associate-I Jobs,https://www.jobkaka.com/csir-nal-project-associatei-post/,Government,Graduate,Rs.25000-25000/-
"Fertilizer Corporation of India Limited (FCIL) Recruitment 2026 - Young Professional (Finance, Company Secretary, Accounts & Other Disciplines) Jobs",https://www.jobkaka.com/fcil-young-professional-finance-company-secretary-accounts-other-disciplines-post/,Government,Graduate,Rs.30000-60000/-
Arunachal Pradesh Public Service Commission Recruitment 2026 - Assistant Professor (Various Disciplines) Jobs,https://www.jobkaka.com/appsc-assistant-professor-various-disciplines-post/,Government,Master's,Rs.57700-182400/-
Hindustan Petroleum Corporation Limited (HPCL) Recruitment 2026 - Graduate Apprentice (Engineering) - Civil / Mechanical / Electrical / Instrumentation Jobs,https://www.jobkaka.com/hpcl-graduate-apprentice-engineering-civil-mechanical-electrical-instrumentation-post/,Government,Graduate,Rs.25000-25000/-
Hindustan Petroleum Corporation Limited Recruitment 2026 - Graduate Apprentice (Engineering) Jobs,https://www.jobkaka.com/hpcl-graduate-apprentice-engineering-post/,Government,Graduate,Rs.25000-25000/-
National High Speed Rail Corporation Limited Recruitment 2026 - Assistant Manager (Design Structure) Jobs,https://www.jobkaka.com/nhsrcl-assistant-manager-design-structure-post/,Government,Graduate,Rs.50000-160000/-
IRCON International Limited Recruitment 2026 - Works Engineer (Civil) Jobs,https://www.jobkaka.com/ircon-works-engineer-civil-post/,Government,Graduate,Rs.36000-36000/-
HLL Lifecare Limited Recruitment 2026 - Management Trainee (Various Disciplines) Jobs,https://www.jobkaka.com/hll-management-trainee-various-disciplines-post/,Government,Graduate,No Details
NBCC (India) Limited Recruitment 2026 - General Manager (Engineering) Jobs,https://www.jobkaka.com/nbcc-general-manager-engineering-post/,Government,Graduate,Rs.90000-240000/-
Hindustan Urvarak & Rasayan Limited (HURL) Recruitment 2026 - Officer / Assistant Manager (Marketing) and other Posts Jobs,https://www.jobkaka.com/hurl-officer-assistant-manager-marketing-post/,Government,Master's,Rs.40000-160000/-
Hindustan Petroleum Corporation Limited (HPCL) Recruitment 2026 - Various Positions for Freshers & Experienced Professionals Jobs,https://www.jobkaka.com/hpcl-various-positions-for-freshers-experienced-professionals-post/,Government,Graduate,No Details
Bharat Electronics Limited (BEL) Recruitment 2026 - Graduate Apprentice Jobs,https://www.jobkaka.com/bel-graduate-apprentice-post-2/,Government,Diploma,Rs.10560-17500/-
"District and Sessions Judge, Palwal Recruitment 2026 - Stenographer Grade-III (English) Jobs",https://www.jobkaka.com/palwal-district-court-stenographer-gradeiii-english-post/,Government,Graduate,Rs.25500-25500/-
Army Public School Chandimandir Cantt Recruitment 2026 - TGT English Jobs,https://www.jobkaka.com/aps-chandimandir-tgt-english-post/,Government,Graduate,Rs.36000-36000/-
Udupi Cochin Shipyard Limited Recruitment 2026 - Assistant General Manager (Engineering) and other Posts Jobs,https://www.jobkaka.com/ucsl-assistant-general-manager-engineering-post/,Government,Graduate,Rs.70000-220000/-
Andhra Pradesh Mahesh Co-operative Urban Bank Ltd. Recruitment 2026 - Branch Manager Jobs,https://www.jobkaka.com/ap-mahesh-bank-branch-manager-post/,Government,Graduate,No Details
Indian Highways Management Company Limited Recruitment 2026 - Product Manager – Rajmargyatra App Jobs,https://www.jobkaka.com/ihmcl-product-manager-rajmargyatra-app-post/,Government,Graduate,Rs.200000-300000/-
Bihar Technical Service Commission Recruitment 2026 - Dairy Field Officer Jobs,https://www.jobkaka.com/btsc-dairy-field-officer-post/,Government,Graduate,Rs.9300-34800/-
"District & Sessions Court, Patiala Recruitment 2026 - Clerk (Adhoc) Jobs",https://www.jobkaka.com/patiala-district-court-clerk-adhoc-post/,Government,Graduate,Rs.29200-29200/-
Forest Research Institute Recruitment 2026 - Senior Project Associate Jobs,https://www.jobkaka.com/fri-icfre-senior-project-associate-post/,Government,Master's,Rs.42000-42000/-
Indian Army Recruitment 2026 - Agniveer Recruitment 2026 Jobs,https://www.jobkaka.com/army-agniveer-recruitment-2026-post/,Government,Graduate,No Details
NBCC (India) Limited Recruitment 2026 - General Manager Jobs,https://www.jobkaka.com/nbcc-general-manager-post/,Government,Graduate,Rs.90000-240000/-
"Space Applications Centre (SAC), ISRO Recruitment 2026 - Scientist/Engineer 'SD' Jobs",https://www.jobkaka.com/sac-scientistengineer-sd-post/,Government,Doctorate,Rs.56100-208700/-
Defence Institute of High Altitude Research Recruitment 2026 - Junior Research Fellow Jobs,https://www.jobkaka.com/dihar-junior-research-fellow-post/,Government,Graduate,Rs.37000-37000/-
National Highways Logistics Management Limited (NHLML) Recruitment 2026 - Deputy Manager – Technical (Port Road Connectivity) Jobs,https://www.jobkaka.com/nhlml-deputy-manager-technical-port-road-connectivity-post/,Government,Graduate,Rs.40000-140000/-
Chhattisgarh Professional Examination Board (CGVYAPAM) Recruitment 2026 - Sub-Inspector (Regular) Jobs,https://www.jobkaka.com/cgvyapam-subinspector-regular-post/,Government,Graduate,Rs.45000-45000/-
Indian Institute of Management (IIM) Kozhikode Recruitment 2026 - Finance & Accounts Officer Jobs,https://www.jobkaka.com/iim-kozhikode-finance-accounts-officer-post/,Government,Master's,Rs.67700-208700/-
Delhi Metro Rail Corporation Ltd. (DMRC) Recruitment 2026 - Supervisor/HR Jobs,https://www.jobkaka.com/dmrc-supervisorhr-post/,Government,Graduate,No Details
"Motilal Nehru College (Evening), University of Delhi Recruitment 2026 - Administrative Officer Jobs",https://www.jobkaka.com/motilal-nehru-college-administrative-officer-post/,Government,Graduate,Rs.10/-
Securities and Exchange Board of India (SEBI) Recruitment 2026 - Young Professional (Securities Market Operations) Jobs,https://www.jobkaka.com/sebi-young-professional-securities-market-operations-post/,Government,Master's,Rs.70000/-
NTPC Limited Recruitment 2026 - Engineering Executive Trainee (EET) – 2025 (E1 Grade) Jobs,https://www.jobkaka.com/ntpc-engineering-executive-trainee-eet-2025-e1-grade-post/,Government,Graduate,Rs.40000-140000/-
Central Sanskrit University Recruitment 2026 - Assistant Jobs,https://www.jobkaka.com/csu-assistant-post/,Government,Graduate,Rs.35400-112400/-
Punjab National Bank Recruitment 2026 - Apprentice Jobs,https://www.jobkaka.com/pnb-apprentice-post/,Government,Graduate,No Details
LGB Regional Institute of Mental Health (LGBRIMH) Recruitment 2026 - Medical Officer Jobs,https://www.jobkaka.com/lgbrimh-medical-officer-post/,Government,Graduate,Rs.20000-60000/-
Security Printing & Minting Corporation of India Limited (SPMCIL) Recruitment 2026 - Young Professional – Cyber Security Expert Jobs,https://www.jobkaka.com/spmcil-young-professional-cyber-security-expert-post/,Government,Graduate,Rs.50000-50000/-
Oil India Limited Recruitment 2026 - Graduate Teacher (Mathematics) Jobs,https://www.jobkaka.com/oil-graduate-teacher-mathematics-post/,Government,Graduate,Rs.32000-127000/-
Bank of Baroda Recruitment 2026 - Assistant Vice President Jobs,https://www.jobkaka.com/bob-assistant-vice-president-post/,Government,Graduate,No Details
Bank of Baroda Recruitment 2026 - Senior Manager – MSME Relationship Jobs,https://www.jobkaka.com/bob-senior-manager-msme-relationship-post/,Government,Graduate,Rs.64820-105280/-
"Government of National Capital Territory of Delhi, Revenue Department, Delhi Recruitment 2026 - Legal Assistant Jobs",https://www.jobkaka.com/revenue-department-delhi-legal-assistant-post/,Government,Graduate,Rs.55930-55930/-
Haryana Public Service Commission (HPSC) Recruitment 2026 - Post Graduate Teacher (PGT) – Computer Science Jobs,https://www.jobkaka.com/hpsc-post-graduate-teacher-pgt-computer-science-post/,Government,Master's,Rs.47600-151100/-
UPSC Recruitment 2026 - Civil Services Examination (CSE) Jobs,https://www.jobkaka.com/upsc-civil-services-examination-cse-post/,Government,Graduate,No Details
Manipur Public Service Commission Recruitment 2026 - PWD Assistant Engineer (Civil) and other Posts Jobs,https://www.jobkaka.com/mpsc-pwd-assistant-engineer-civil-post/,Government,Graduate,Rs.34800/-
Union Public Service Commission Recruitment 2026 - Indian Forest Service (IFS) Exam 2026 Jobs,https://www.jobkaka.com/upsc-indian-forest-service-ifs-exam-2026-post/,Government,Graduate,No Details
Central Bank of India Recruitment 2026 - Foreign Exchange Officer (Scale III) Jobs,https://www.jobkaka.com/cbi-foreign-exchange-officer-scale-iii-post-2/,Government,Graduate,Rs.85920-105280/-
Union Public Service Commission Recruitment 2026 - Civil Services Examination Jobs,https://www.jobkaka.com/upsc-civil-services-examination-post/,Government,Graduate,No Details
Madhya Pradesh Police Headquarters Recruitment 2026 - Assistant Sub-Inspector (Computer) Jobs,https://www.jobkaka.com/mp-police-assistant-subinspector-computer-post/,Government,Graduate,Rs.28700-91300/-
"Rajasthan Staff Selection Board, Jaipur Recruitment 2026 - Supervisor (Women) Jobs",https://www.jobkaka.com/rssb-supervisor-women-post/,Government,Graduate,No Details
National Housing Bank (NHB) Recruitment 2026 - General Manager – Credit Monitoring Jobs,https://www.jobkaka.com/nhb-general-manager-credit-monitoring-post/,Government,Master's,Rs.156500-173860/-
Hindustan Copper Limited Recruitment 2026 - Hindi Translator (Grade T-10) Jobs,https://www.jobkaka.com/hcl-hindi-translator-grade-t10-post/,Government,Master's,Rs.28740-72110/-
Madhya Pradesh Public Service Commission Recruitment 2026 - Assistant Town Planner Jobs,https://www.jobkaka.com/mppsc-assistant-town-planner-post/,Government,Graduate,Rs.56100-177500/-
Indian Institute of Technology Jammu (IIT Jammu) Recruitment 2026 - Public Relations Officer Jobs,https://www.jobkaka.com/iit-jammu-public-relations-officer-post/,Government,Master's,Rs.177500/-
CSIR - Central Road Research Institute Recruitment 2026 - Junior Hindi Translator Jobs,https://www.jobkaka.com/csir-crri-junior-hindi-translator-post/,Government,Master's,Rs.35400-112400/-
"Prasar Bharati – Akashvani, Regional News Unit, Cuttack Recruitment 2026 - Casual Broadcast Assistant Jobs",https://www.jobkaka.com/prasar-bharati-casual-broadcast-assistant-post-2/,Government,Graduate,No Details
AIIMS Jodhpur (All India Institute of Medical Sciences) Recruitment 2026 - Nursing Officer Jobs,https://www.jobkaka.com/aiims-jodhpur-nursing-officer-post/,Government,Graduate,Rs.30000-40000/-
Employees' State Insurance Corporation (ESIC) Recruitment 2026 - Insurance Medical Officer (IMO) Grade-II (Allopathic) Jobs,https://www.jobkaka.com/esic-insurance-medical-officer-imo-gradeii-allopathic-post/,Government,Graduate,Rs.56100-177500/-
Indian Institute of Management Jammu Recruitment 2026 - Project Engineer / Estate Officer Jobs,https://www.jobkaka.com/iim-jammu-project-engineer-estate-officer-post/,Government,Graduate,Rs.25500-78800/-
"Ministry of Ayush, Government of India Recruitment 2026 - Young Professional (Contract Basis) Jobs",https://www.jobkaka.com/ministry-of-ayush-young-professional-contract-basis-post/,Government,Graduate,Rs.40000-40000/-
"National Ayush Mission, Ministry of Ayush (Government of India) Recruitment 2026 - Senior Programme Manager Jobs",https://www.jobkaka.com/national-ayush-mission-senior-programme-manager-post/,Government,Graduate,Rs.100000/-
IRCON International Limited Recruitment 2026 - Graduate Apprentice Jobs,https://www.jobkaka.com/ircon-graduate-apprentice-post/,Government,Graduate,Rs.8500-8500/-
Bharat Sanchar Nigam Limited (BSNL) Recruitment 2026 - Senior Executive Trainee SET Jobs,https://www.jobkaka.com/bsnl-senior-executive-trainee-set-post/,Government,Graduate,No Details
भारत संचार निगम लिमिटेड (BSNL) Recruitment 2026 - सीनियर एग्जीक्यूटिव ट्रेनिंग Jobs,https://www.jobkaka.com/bsnl-post/,Government,Graduate,No Details
Bank of Baroda Recruitment 2026 - Assistant Vice President - Senior Cloud Engineer Jobs,https://www.jobkaka.com/bob-assistant-vice-president-senior-cloud-engineer-post/,Government,Master's,No Details
"All India Institute of Medical Sciences (AIIMS), New Delhi Recruitment 2026 - General Duty Medical Officer and other Posts Jobs",https://www.jobkaka.com/aiims-general-duty-medical-officer-post/,Government,Graduate,Rs.56100-208700/-
Saurashtra University Recruitment 2026 - Secretarial Assistant (SPRIHA IPR Chair) Jobs,https://www.jobkaka.com/saurashtra-university-secretarial-assistant-spriha-ipr-chair-post/,Government,Graduate,Rs.15000-15000/-
"Central Sanskrit University (CSU), New Delhi Recruitment 2026 - College Librarian Jobs",https://www.jobkaka.com/csu-college-librarian-post/,Government,Graduate,Rs.10/-
"Dr. Bhimrao Ambedkar University (DBRAU), Agra Recruitment 2026 - Professor Jobs",https://www.jobkaka.com/dbrau-professor-post/,Government,Doctorate,No Details
Bank of Baroda Recruitment 2026 - AVP I – Business Finance Analyst (BFSI Exposure) Jobs,https://www.jobkaka.com/bob-avp-i-business-finance-analyst-bfsi-exposure-post/,Government,Graduate,No Details
Madhya Pradesh Public Service Commission (MPPSC) Recruitment 2026 - State Services Examination 2026 Jobs,https://www.jobkaka.com/mppsc-state-services-examination-2026-post/,Government,Graduate,No Details
Mumbai Port Authority Recruitment 2026 - Marine Engineer (Regular) Jobs,https://www.jobkaka.com/mpa-marine-engineer-regular-post/,Government,Professional,No Details
CSIR - National Physical Laboratory (CSIR-NPL) Recruitment 2026 - Technical Assistant (Group III) Jobs,https://www.jobkaka.com/csir-npl-technical-assistant-group-iii-post/,Government,Graduate,Rs.35400-112400/-
Delhi State Health Mission Recruitment 2026 - Pharmacist Jobs,https://www.jobkaka.com/dshm-pharmacist-post/,Government,Graduate,Rs.32600-32600/-
Atma Ram Sanatan Dharma College (University of Delhi) Recruitment 2026 - Assistant Professor Jobs,https://www.jobkaka.com/arsd-college-assistant-professor-post/,Government,Master's,Rs.57700-182400/-
Central Silk Board Recruitment 2026 - Scientist-B (Post-Cocoon Sector) Jobs,https://www.jobkaka.com/csb-scientistb-postcocoon-sector-post/,Government,Graduate,Rs.56100-177500/-
"Indian Statistical Institute, Kolkata Recruitment 2026 - SECTION OFFICER (GENERAL) and other Posts Jobs",https://www.jobkaka.com/isi-kolkata-section-officer-general-post/,Government,Graduate,Rs.142400/-
Central Bank of India - RSETI Jalpaiguri Recruitment 2026 - Faculty Jobs,https://www.jobkaka.com/central-bank-of-india-faculty-post/,Government,Master's,Rs.30000-40000/-
Balmer Lawrie & Co. Ltd. Recruitment 2026 - Full-Time Retainer Jobs,https://www.jobkaka.com/balmer-lawrie-fulltime-retainer-post/,Government,Graduate,No Details
"Indian Statistical Institute (ISI), Kolkata Recruitment 2026 - Associate Scientist ‘A’ (Computer Science) Jobs",https://www.jobkaka.com/isi-associate-scientist-a-computer-science-post/,Government,Graduate,Rs.19900-142400/-
Hindustan Copper Limited Recruitment 2026 - Young Professional (Geology) Jobs,https://www.jobkaka.com/hcl-young-professional-geology-post/,Government,Master's,Rs.65000/-
Indian Navy Recruitment 2026 - Executive Branch {GS(X)/ Hydro Cadre Jobs,https://www.jobkaka.com/navy-executive-branch-gsx-hydro-cadre-post/,Government,Graduate,No Details
Central Bank of India Recruitment 2026 - Foreign Exchange Officer (Scale III) Jobs,https://www.jobkaka.com/cbi-foreign-exchange-officer-scale-iii-post/,Government,Graduate,Rs.85920-105280/-
Bihar Police Subordinate Services Commission (BPSSC) Recruitment 2026 - Sub-Inspectors Prohibition Jobs,https://www.jobkaka.com/bpssc-subinspectors-prohibition-post/,Government,Graduate,No Details
IIFCL Projects Limited Recruitment 2026 - Consultant Jobs,https://www.jobkaka.com/ipl-consultant-post/,Government,Graduate,No Details
Goa Shipyard Limited Recruitment 2026 - Assistant Superintendent (Stores/Commercial) Jobs,https://www.jobkaka.com/gsl-assistant-superintendent-storescommercial-post/,Government,Graduate,Rs.21000-70000/-
National Aluminium Company Limited (NALCO) Recruitment 2026 - Graduate Engineer Trainee (GET) Jobs,https://www.jobkaka.com/nalco-graduate-engineer-trainee-get-post/,Government,Graduate,Rs.40000-140000/-
Indian Exim Bank Recruitment 2026 - Management Trainee (MT) (Banking Operations) Jobs,https://www.jobkaka.com/exim-bank-management-trainee-mt-banking-operations-post/,Government,Graduate,No Details
Export–Import Bank of India Recruitment 2026 - Management Trainee (Banking Operations) Jobs,https://www.jobkaka.com/exim-bank-management-trainee-banking-operations-post/,Government,Graduate,Rs.65000/-
NABARD Recruitment 2026 - Development Assistant Jobs,https://www.jobkaka.com/nabard-development-assistant-post-2/,Government,Graduate,No Details
CSIR Central Drug Research Institute Recruitment 2026 - Hindi Officer Jobs,https://www.jobkaka.com/csir-cdri-hindi-officer-post/,Government,Master's,Rs.97452/-
"Goa Shipyard Limited (GSL), Ministry of Defence Recruitment 2026 - Expert / Specialist – GES & SR (Patrol Boats) Jobs",https://www.jobkaka.com/gsl-expert-specialist-ges-sr-patrol-boats-post/,Government,Graduate,No Details
Tamilnad Mercantile Bank Limited Recruitment 2026 - Branch Head (Manager / Senior Manager / Assistant Vice President) Jobs,https://www.jobkaka.com/tmb-branch-head-manager-senior-manager-assistant-vice-president-post/,Government,Post Graduate,No Details
Engineers India Limited Recruitment 2026 - Deputy Manager (CSR) Jobs,https://www.jobkaka.com/eil-deputy-manager-csr-post/,Government,Not Applicable,Rs.70000-200000/-
Hindustan Urvarak & Rasayan Limited Recruitment 2026 - Executive Jobs,https://www.jobkaka.com/hurl-executive-post/,Government,Graduate,No Details
Railway Recruitment Board (RRB) Recruitment 2026 - Chief Law Assistant Jobs,https://www.jobkaka.com/rrb-chief-law-assistant-post/,Government,Master's,No Details
BEML Limited Recruitment 2026 - Deputy General Manager Jobs,https://www.jobkaka.com/beml-deputy-general-manager-post/,Government,Graduate,Rs.90000-240000/-
Engineers India Limited (EIL) Recruitment 2026 - Assistant General Manager Jobs,https://www.jobkaka.com/eil-assistant-general-manager-post/,Government,Graduate,Rs.70000-260000/-
National Forensic Sciences University (NFSU) Recruitment 2026 - Deputy Registrar Jobs,https://www.jobkaka.com/nfsu-deputy-registrar-post/,Government,Master's,No Details
Engineers India Limited (EIL) Recruitment 2025 - Associate Engineer Grade III Jobs,https://www.jobkaka.com/eil-associate-engineer-grade-iii-post/,Government,Graduate,No Details
Tamil Nadu National Law University Recruitment 2025 - Assistant Registrar (Finance) Jobs,https://www.jobkaka.com/tnnlu-assistant-registrar-finance-post/,Government,Master's,Rs.50000-50000/-
Railway Recruitment Boards (RRB) Recruitment 2026 - Senior Publicity Inspector Jobs,https://www.jobkaka.com/rrb-senior-publicity-inspector-post/,Government,Graduate,Rs.19900-44900/-
West Bengal Health and Family Welfare Samiti Recruitment 2025 - Public Health Manager Jobs,https://www.jobkaka.com/wbshfws-public-health-manager-post/,Government,Graduate,Rs.35000-35000/-
Reserve Bank of India (RBI) Recruitment 2026 - Data Scientist Jobs,https://www.jobkaka.com/rbi-data-scientist-post/,Government,Graduate,No Details
Union Public Service Commission Recruitment 2026 - Examiner Jobs,https://www.jobkaka.com/upsc-examiner-post/,Government,Graduate,No Details
Fluid Control Research Institute (FCRI) Recruitment 2025 - Trainee Engineer (Graduate / Diploma) Jobs,https://www.jobkaka.com/fcri-trainee-engineer-graduate-diploma-post/,Government,Graduate,Rs.28000-28000/-
Manohar Parrikar Institute for Defence Studies and Analyses (MP-IDSA) Recruitment 2025 - Research Fellow Jobs,https://www.jobkaka.com/mp-idsa-research-fellow-post/,Government,Postgraduate,Rs.35400-209200/-
"The Asiatic Society, Kolkata Recruitment 2026 - Controller of Finance Jobs",https://www.jobkaka.com/asiatic-society-controller-of-finance-post/,Government,Graduate,Rs.35400-208700/-
Central Bank of India – RSETI Tinsukia (Upper Assam Region) Recruitment 2025 - Faculty Jobs,https://www.jobkaka.com/cbi-rseti-faculty-post/,Government,Graduate,Rs.40000/-
Kendriya Vidyalaya Sangathan (KVS) Recruitment 2025 - Principal Jobs,https://www.jobkaka.com/kvs-principal-post-2/,Government,Graduate,No Details
Defence Research and Development Organisation (DRDO) Recruitment 2026 - Senior Technician Assistant-B Jobs,https://www.jobkaka.com/drdo-senior-technician-assistantb-post-2/,Government,Graduate,No Details
West Bengal Power Development Corporation Limited Recruitment 2025 - Executive Director (Operation Service) Jobs,https://www.jobkaka.com/wbpdcl-executive-director-operation-service-post/,Government,Graduate,Rs.156500-210800/-
Bharat Electronics Limited (BEL) Recruitment 2025 - Graduate Apprentices Jobs,https://www.jobkaka.com/bel-graduate-apprentices-post-2/,Government,Graduate,Rs.17500-17500/-
National Law University Odisha Recruitment 2025 - Guest Faculty Jobs,https://www.jobkaka.com/nluo-guest-faculty-post/,Government,Master's,Rs.1500/-
National Biodiversity Authority Recruitment 2026 - Consultant B (Legal) Jobs,https://www.jobkaka.com/nba-consultant-b-legal-post/,Government,Master's,Rs.80000-80000/-
Power Grid Corporation of India Limited (POWERGRID) Recruitment 2025 - Company Secretary Professional (Fixed Tenure Basis) Jobs,https://www.jobkaka.com/powergrid-company-secretary-professional-fixed-tenure-basis-post/,Government,Graduate,Rs.30000-120000/-
NTPC Limited (A Govt. of India Enterprise) Recruitment 2025 - Executive (Combined Cycle Power Plant / O&M) Jobs,https://www.jobkaka.com/ntpc-executive-combined-cycle-power-plant-om-post/,Government,Graduate,No Details
Indian Institute of Banking and Finance (IIBF) Recruitment 2025 - Junior Executive Jobs,https://www.jobkaka.com/iibf-junior-executive-post/,Government,Graduate,Rs.40400-130400/-
Hemchandracharya North Gujarat University Recruitment 2025 - P.S. to V.C. Jobs,https://www.jobkaka.com/ngu-ps-to-vc-post/,Government,Master's,Rs.44900/-
Indian Institute of Technology Ropar Recruitment 2025 - Project Engineer (Civil) Jobs,https://www.jobkaka.com/iit-ropar-project-engineer-civil-post/,Government,Graduate,Rs.100000/-
"Maitreyi College (University of Delhi), New Delhi Recruitment 2025 - Assistant Professor Jobs",https://www.jobkaka.com/maitreyi-college-assistant-professor-post/,Government,Master's,Rs.10/-
South 24 Parganas District Recruitment 2025 - Medical Officer Jobs,https://www.jobkaka.com/s24p-medical-officer-post/,Government,Graduate,Rs.60000-60000/-
"Health Department, Haryana (Director General Health Services) Recruitment 2026 - Medical Officer (HCMS Group-A) Jobs",https://www.jobkaka.com/haryana-health-medical-officer-hcms-groupa-post/,Government,Graduate,No Details
Kendriya Vidyalaya Sangathan Recruitment 2025 - PGT Jobs,https://www.jobkaka.com/kvs-pgt-post/,Government,Graduate,Rs.2300/-
भारत डायनेमिक्स लिमिटेड Recruitment 2025 - मैनेजमेंट ट्रेनी Jobs,https://www.jobkaka.com/bdl-post/,Government,Graduate,No Details
Central Board of Secondary Education (CBSE) Recruitment 2025 - Principal Jobs,https://www.jobkaka.com/cbse-principal-post/,Government,Graduate,Rs.2800/-
Institute for Defence Studies and Analyses (IDSA) Recruitment 2025 - Research Analyst Jobs,https://www.jobkaka.com/idsa-research-analyst-post/,Government,Master's,Rs.35400-35400/-
Rashtriya Chemicals and Fertilizers Limited (RCF Ltd) Recruitment 2025 - Management Trainee (Safety) Jobs,https://www.jobkaka.com/rcf-ltd-management-trainee-safety-post/,Government,Graduate,Rs.40000-140000/-
Paradip Port Authority Recruitment 2026 - Trainee Pilot Jobs,https://www.jobkaka.com/ppa-trainee-pilot-post/,Government,Master's,Rs.140000/-
Oil India Limited Recruitment 2025 - Contractual Liaisoning/Coordinating Officer Jobs,https://www.jobkaka.com/oil-contractual-liaisoningcoordinating-officer-post/,Government,Graduate,Rs.65000/-
Central Board of Secondary Education Recruitment 2025 - Assistant Secretary Jobs,https://www.jobkaka.com/cbse-assistant-secretary-post/,Government,Graduate,No Details
Uttar Pradesh Public Service Commission Recruitment 2026 - Polytechnic Lecturer Jobs,https://www.jobkaka.com/uppsc-polytechnic-lecturer-post/,Government,Graduate,No Details
State Bank of India Recruitment 2025 - VP Wealth (SRM) Jobs,https://www.jobkaka.com/sbi-vp-wealth-srm-post/,Government,Graduate,Rs.4567/-
State Bank of India Recruitment 2025 - Vice President Wealth (Senior Relationship Manager) Jobs,https://www.jobkaka.com/sbi-vice-president-wealth-senior-relationship-manager-post/,Government,Graduate,No Details
Anusandhan National Research Foundation Recruitment 2026 - Scientist-D Jobs,https://www.jobkaka.com/anrf-scientistd-post/,Government,Graduate,Rs.67700-209200/-
"All India Institute of Medical Sciences, Jammu Recruitment 2025 - Superintending Engineer Jobs",https://www.jobkaka.com/aiims-jammu-superintending-engineer-post/,Government,Graduate,Rs.13/-
Ministry of Development of North Eastern Region Recruitment 2025 - Junior Consultant (NEC Secretariat) Jobs,https://www.jobkaka.com/mdoner-junior-consultant-nec-secretariat-post/,Government,Master's,Rs.37000-37000/-
Bank of India (BOI) Recruitment 2025 - Senior Manager and other Posts Jobs,https://www.jobkaka.com/boi-senior-manager-post/,Government,Master's,Rs.85920-120940/-
Central Bank of India Recruitment 2025 - Faculty – RSETI Jobs,https://www.jobkaka.com/cbi-faculty-rseti-post/,Government,Graduate,Rs.30000-30000/-
